{"format":"rl-s6-campaign-result-v3","source_v1_decision":"FAILED_RL_S6","source_v2_decision":"FAILED_RL_S6_V2","decision":"RL_S6_V3_PASSED","conforming_seed_count":4,"required_conforming_seed_count":4,"no_training":true,"no_new_matches":true,"seeds":[{"seed":19,"candidate_unit":110,"checkpoint_sha256":"0000000000000000000000000000000000000000000000000000000000000000","v2_gate_sha256":"0000000000000000000000000000000000000000000000000000000000000000","v2_records_sha256":"0000000000000000000000000000000000000000000000000000000000000000","gate":{"format":"rl-s6-publication-evaluation-v3","blocking_criteria":{},"failed_criteria":[],"warnings":[],"individual_drops":{},"decision":"pass"}},{"seed":20,"candidate_unit":90,"checkpoint_sha256":"0000000000000000000000000000000000000000000000000000000000000000","v2_gate_sha256":"0000000000000000000000000000000000000000000000000000000000000000","v2_records_sha256":"0000000000000000000000000000000000000000000000000000000000000000","gate":{"format":"rl-s6-publication-evaluation-v3","blocking_criteria":{},"failed_criteria":[],"warnings":[],"individual_drops":{},"decision":"pass"}},{"seed":21,"candidate_unit":125,"checkpoint_sha256":"0000000000000000000000000000000000000000000000000000000000000000","v2_gate_sha256":"0000000000000000000000000000000000000000000000000000000000000000","v2_records_sha256":"0000000000000000000000000000000000000000000000000000000000000000","gate":{"format":"rl-s6-publication-evaluation-v3","blocking_criteria":{},"failed_criteria":[],"warnings":[],"individual_drops":{},"decision":"pass"}},{"seed":22,"candidate_unit":95,"checkpoint_sha256":"0000000000000000000000000000000000000000000000000000000000000000","v2_gate_sha256":"0000000000000000000000000000000000000000000000000000000000000000","v2_records_sha256":"0000000000000000000000000000000000000000000000000000000000000000","gate":{"format":"rl-s6-publication-evaluation-v3","blocking_criteria":{},"failed_criteria":[],"warnings":[],"individual_drops":{},"decision":"pass"}},{"seed":23,"candidate_unit":105,"checkpoint_sha256":"0000000000000000000000000000000000000000000000000000000000000000","v2_gate_sha256":"0000000000000000000000000000000000000000000000000000000000000000","v2_records_sha256":"0000000000000000000000000000000000000000000000000000000000000000","gate":{"format":"rl-s6-publication-evaluation-v3","blocking_criteria":{},"failed_criteria":[],"warnings":[],"individual_drops":{},"decision":"pass"}}]}
